{
  "format": "taowind.opp.invocation-spec.v0.1",
  "version": "0.3.0-candidate.1",
  "adapterKind": "python-function",
  "sourceRoot": ".",
  "callingConvention": "kwargs",
  "timeoutMs": 3000,
  "maxOutputBytes": 262144,
  "cwdPolicy": "ephemeral",
  "environmentPolicy": "sanitized",
  "authorityRequired": [],
  "status": "candidate",
  "specId": "fixture-producer",
  "entrypoint": "examples/native-fixtures/producer.py:produce_user"
}
